id,Address,Response_Address,Response_X,Response_Y
1,臺中市梧棲區臺灣大道九段４２號,,,
2,臺中市南區和昌街１５６號,,,
3,臺中市南屯區楓樹西街１８９之２號,,,
4,臺中市西屯區福上巷龍欣一弄３號,,,
5,臺中市梧棲區大勇二路１８號,,,
6,臺中市梧棲區大勇二路１８號,,,
7,臺中市北區柳川東路四段１３號,,,
8,臺中市北屯區青島路三段２３５之５號,,,
9,臺中市西區福人街１４２號,,,
10,臺中市西屯區至善路２４２號,,,
11,臺中市豐原區三豐路二段８９巷３７號,,,
12,臺中市梧棲區自強一街９０巷３５號,,,
13,臺中市太平區永平南路４５號,,,
14,臺中市太平區新仁路一段１９２號,,,
15,臺中市西屯區至善路１２１巷６號,,,
16,臺中市西屯區福聯街７２號,,,
17,臺中市西屯區青海南街２０５號,,,
18,臺中市梧棲區自強一街９０巷３５號,,,
19,臺中市西屯區福聯街１５巷９號,,,
20,臺中市西屯區福聯街１５巷９號,,,
21,臺中市中區民權路２２號,,,
22,臺中市中區民族路６４號,,,
23,臺中市北區錦南街１９之３號,,,
24,臺中市西屯區國安一路２０６巷１８號,,,
25,臺中市西屯區上石北２巷１５號,,,
26,臺中市西屯區西屯路三段１６６之１００號,,,
27,臺中市西屯區至善路８２巷２４號,,,
28,臺中市后里區民生路３８９號,,,
29,臺中市太平區永平南路４７號,,,
30,臺中市西區五權西一街１２３號,,,
31,臺中市北區育強街１１７之２號,,,
32,臺中市大甲區水源路２６６號,,,
33,臺中市梧棲區永寧路６７巷５８號,,,
34,臺中市梧棲區永寧路３６巷３４號,,,
35,臺中市沙鹿區星河路１６６號,,,
36,臺中市西區三民路１段５０巷８號,,,
37,臺中市西區大墩１９街７號,,,
38,臺中市北區北屯路４９號,,,
39,臺中市西屯區文心路三段１９９之２號,,,
40,臺中市西屯區環中路三段８００號,,,
41,臺中市南屯區嶺東南路４０號,,,
42,臺中市豐原區中陽路５３７巷１５號,,,
43,臺中市豐原區豐西街２６號,,,
44,臺中市豐原區豐西街２６號,,,
45,臺中市豐原區豐西街２６號,,,
46,臺中市豐原區豐西街２６號,,,
47,臺中市大里區仁愛路１９巷１５號,,,
48,臺中市太平區中山路四段２８巷１７弄１４號,,,
49,臺中市北屯區南興路７０１號,,,
50,臺中市南屯區文心路一段３７８號,,,
51,臺中市西屯區文心路三段６號,,,
52,臺中市豐原區愛國街１０９號,,,
53,臺中市梧棲區居仁街６３巷１８號,,,
54,臺中市梧棲區八德東路６９號,,,
55,臺中市大里區塗城路６７３巷１３弄１５號,,,
56,臺中市大里區向上街３６巷６之７號,,,
57,臺中市太平區正誠街２５６巷４２號,,,
58,臺中市南區復興路一段２７１號,,,
59,臺中市北區進化北路２６３號,,,
60,臺中市北區北屯路４９號,,,
61,臺中市南屯區惠文路５２８號,,,
62,臺中市南屯區文心南二路５２２號,,,
63,臺中市豐原區合作街１６０巷２弄１號,,,
64,臺中市沙鹿區忠貞路２９１號,,,
65,臺中市烏日區環河北路２４８號,,,
66,臺中市太平區光興路１１６５巷４２號,,,
67,臺中市太平區環太東路２２１之５號,,,
68,臺中市北區忠明八街１４號,,,
69,臺中市潭子區祥和路１７２巷４２之１號,,,
70,臺中市南區德富路３０號,,,
71,臺中市南屯區文心南路２２７號,,,
72,臺中市北區進化路５１７號,,,
73,臺中市西屯區西屯路二段２６８之８巷１號,,,
74,臺中市南屯區河南路四段５２２號,,,
75,臺中市西屯區國安一路１２９號,,,
76,臺中市東勢區文新二街３１號,,,
77,臺中市潭子區大明一路１０６巷２０號,,,
78,臺中市龍井區南社三街６８號,,,
79,臺中市西區五權路２２巷１２號,,,
80,臺中市南區新和街２０３號,,,
81,臺中市北屯區昌平路二段國泰巷５１號,,,
82,臺中市北屯區中清路二段４１５巷４０弄３３號,,,
83,臺中市北屯區太原路三段１３９巷１號,,,
84,臺中市西屯區工業區三十八路６８號,,,
85,臺中市后里區成功路５１６號,,,
86,臺中市神岡區大漢街６３巷１９號,,,
87,臺中市梧棲區自強一街９０巷３５號,,,
88,臺中市梧棲區八德東路６９號,,,
89,臺中市沙鹿區保成一街１２巷２８號,,,
90,臺中市梧棲區臨港路四段５８８號,,,
91,臺中市梧棲區臨港路四段８８２巷３３號,,,
92,臺中市沙鹿區長春路２５０號,,,
93,臺中市潭子區和平路３３巷２１號,,,
94,臺中市大里區大智路５６５巷２５之７號,,,
95,臺中市大里區現岱路１１號,,,
96,臺中市大里區環中東路六段１６巷５號,,,
97,臺中市大里區中興路二段７７０號,,,
98,臺中市南屯區春安路７０號,,,
99,臺中市西屯區長安路二段２７８號,,,
100,臺中市大甲區甲后路五段３３５巷２００弄１０號,,,
101,臺中市東勢區東蘭路永盛巷１１２之１號,,,
102,臺中市大雅區學府路７６巷１１號,,,
103,臺中市霧峰區民生路５８７號,,,
104,臺中市南屯區永春路１２之３號,,,
105,臺中市西區長春街５２號,,,
106,臺中市西區公益路１１９號,,,
107,臺中市西區忠仁街３７－１號,,,
108,臺中市北區育德路１０號,,,
109,臺中市北區育強街１０３之１號,,,
110,臺中市南屯區向上路三段６７號,,,
111,臺中市西屯區西屯路二段２５９之３號,,,
112,臺中市南屯區寶山東二街１９巷６號,,,
113,臺中市梧棲區文化路二段２９７號,,,
114,臺中市東勢區東蘭路１９５之１號,,,
115,臺中市潭子區潭興路一段５５號,,,
116,臺中市烏日區僑仁街８號,,,
117,臺中市大里區吉隆路４巷２３號,,,
118,臺中市西區精誠五街３３號,,,
119,臺中市西區忠明南路１１２號,,,
120,臺中市南區文心南路９０１巷３３號,,,
121,臺中市西區民生路１９７號,,,
122,臺中市豐原區水源路中坑巷３８號,,,
123,臺中市后里區三光路１７號,,,
124,臺中市梧棲區八德東路６９號,,,
125,臺中市新社區井南街２１號,,,
126,臺中市東勢區本街２９２號,,,
127,臺中市大里區內元路８７巷３４號,,,
128,臺中市大肚區遊園路一段８７巷２弄１８號,,,
129,臺中市大肚區永和街１之１８號,,,
130,臺中市太平區中山路一段２８２巷６１號,,,
131,臺中市中區光復路１０４號,,,
132,臺中市中區中華路１段１１４號,,,
133,臺中市南區忠孝路１２３巷４弄６之４號,,,
134,臺中市南區信義南街１５７號,,,
135,臺中市北屯區松竹路一段８８３號,,,
136,臺中市北屯區崇德路二段３１９號,,,
137,臺中市北區英士路９１號,,,
138,臺中市北區東光東街５９號,,,
139,臺中市北屯區敦化路一段４５０巷１號,,,
140,臺中市西屯區甘州街５７號,,,
141,臺中市南屯區永春路１０之１號,,,
142,臺中市西屯區黎明路三段３２２號,,,
143,臺中市南屯區大業路５６０號,,,
144,臺中市西屯區臺灣大道三段３９９號,,,
145,臺中市西屯區國安一路１２７號,,,
146,臺中市神岡區大豐北街９５號,,,
147,臺中市神岡區大社街１１０巷１３號,,,
148,臺中市豐原區圓環北路二段１３７號,,,
149,臺中市神岡區豐工三路１０號,,,
150,臺中市梧棲區臨港路四段５８８號,,,
151,臺中市梧棲區居仁街６３巷１８之３號,,,
152,臺中市沙鹿區臺灣大道七段４３２巷６６弄４５號,,,
153,臺中市潭子區興華一路３５７巷２５弄２號,,,
154,臺中市大雅區中清路三段１０２３巷７８號,,,
155,臺中市霧峰區四德路３１９巷９８號,,,
156,臺中市太平區永豐北路６８號,,,
157,臺中市太平區環中東路三段２６５號,,,
158,臺中市大肚區沙田路二段２巷２１之５號,,,
159,臺中市龍井區新興路２５巷１弄１８號,,,
160,臺中市南區學府路１６８巷５號,,,
161,臺中市南區大慶街１段８４號,,,
162,臺中市南區五權南路４８３號,,,
163,臺中市北屯區文心路四段９５５號,,,
164,臺中市北屯區綏遠路二段４１號,,,
165,臺中市北屯區天津路四段３０９號,,,
166,臺中市北屯區東山路一段１４７巷４０弄１１之４４號,,,
167,臺中市北屯區軍福十三路３６之３５號,,,
168,臺中市南屯區三和街１２８之１號,,,
169,臺中市西屯區福聯街１５巷９號,,,
170,臺中市西屯區文心路三段２９６號,,,
171,臺中市西屯區弘孝路６７之１１號,,,
172,臺中市南屯區大墩六街３３５號,,,
173,臺中市后里區甲后路三段２００巷３８弄１５號,,,
174,臺中市大雅區學府路１０１巷２６弄８號,,,
175,臺中市大里區新生路１７４之２號,,,
176,臺中市霧峰區吉峰東路５２８巷６號,,,
177,臺中市北屯區三光巷２號,,,
178,臺中市南區五權南路４８３號,,,
179,臺中市中區民權路１６４號,,,
180,臺中市東區信義街７９號,,,
181,臺中市南區德富路９７號,,,
182,臺中市北屯區崇德二路二段１１０號,,,
183,臺中市北區漢口路四段２０８之４號,,,
184,臺中市北屯區興安路二段４４９號,,,
185,臺中市北區梅亭街６４６巷７號,,,
186,臺中市北屯區文昌東五街５３號,,,
187,臺中市南屯區河南路四段３６０號,,,
188,臺中市西屯區市政北一路２８號,,,
189,臺中市西屯區市政北一路２６５號,,,
190,臺中市豐原區圓環北路一段２２６之２號,,,
191,臺中市沙鹿區向上路六段７７２號,,,
192,臺中市清水區港新五路２３９號,,,
193,臺中市梧棲區中央路二段２８２之１號,,,
194,臺中市潭子區弘智一街１６８號,,,
195,臺中市大里區向善街２７號,,,
196,臺中市烏日區五光路３５巷３３號,,,
197,臺中市太平區振福路９７號,,,
198,臺中市北屯區軍和街４４９號,,,
199,臺中市北區德化街２９號,,,
200,臺中市北屯區敦富路７０６號,,,
201,臺中市西區建國路２１號,,,
202,臺中市梧棲區居仁街６３巷１８號,,,
203,臺中市沙鹿區福鹿街５６號,,,
204,臺中市烏日區三榮路一段３４６號,,,
205,臺中市西區忠誠街１２９號,,,
206,臺中市烏日區高鐵路二段１５０號,,,
207,臺中市大里區現岱路１３７號,,,
208,臺中市北區進化北路３６７號,,,
209,臺中市北屯區北屯路４３９之１７巷２弄５號,,,
210,臺中市西屯區市政北一路２６５號,,,
211,臺中市霧峰區樹仁二街５０號,,,
212,臺中市中區民族路２０７號,,,
213,臺中市西屯區福上巷２３９之１號,,,
214,臺中市西屯區大祥街１３７號,,,
215,臺中市霧峰區樹仁二街４２號,,,
216,臺中市大肚區文昌二街９３巷１號,,,
217,臺中市南屯區精誠路５３０巷２４號,,,
218,臺中市西區中華路１段１－７號,,,
219,臺中市西區五權八街１４３號,,,
220,臺中市北屯區衛道路４０號,,,
221,臺中市南屯區寶山東一街８號,,,
222,臺中市南屯區龍富路三段５６２號,,,
223,臺中市南屯區公益路二段６１５號,,,
224,臺中市西屯區福瑞街７５巷１１號,,,
225,臺中市大甲區甲后路五段５０１巷１０１弄１５號,,,
226,臺中市大里區祥興路５０３號,,,
227,臺中市烏日區學田路２８巷６號,,,
228,臺中市太平區長億一街８２號,,,
229,臺中市龍井區藝術街５６號,,,
230,臺中市南區南陽街９６號,,,
231,臺中市北區梅川西路四段１４７號,,,
232,臺中市北屯區平興街１６８號,,,
233,臺中市西屯區市政北五路８號,,,
234,臺中市豐原區忠孝街７９巷２４號,,,
235,臺中市大里區現岱路１０５巷１弄２號,,,
236,臺中市龍井區新興路２９號,,,
237,臺中市中區三民路二段１７巷８號,,,
238,臺中市北區忠太東路８號,,,
239,臺中市北屯區遼寧路一段１２６號,,,
240,臺中市北屯區旱溪東路三段３９號,,,
241,臺中市南屯區春安三街１９８號,,,
242,臺中市南屯區大業路２４１號,,,
243,臺中市西屯區西屯路二段２６８之８巷１號,,,
244,臺中市西屯區黎明路三段３２０號,,,
245,臺中市大甲區三民路２４２號,,,
246,臺中市清水區鰲峰一街１７號,,,
247,臺中市太平區環中東路三段７６８號,,,
248,臺中市北區原子街１６２號,,,
249,臺中市西屯區西安街１３０巷１０號,,,
250,臺中市南屯區保安六街１４３號,,,
251,臺中市南屯區忠勇路１２之２３號,,,
252,臺中市西屯區黎明路三段３１６號,,,
253,臺中市神岡區中山路１４２６巷２３號,,,
254,臺中市清水區五權路２９３巷３０號,,,
255,臺中市梧棲區自強一街９０巷３５號,,,
256,臺中市梧棲區自強一街９０巷３５號,,,
257,臺中市梧棲區自強一街９０巷３５號,,,
258,臺中市東勢區本街中正一巷１５之１號,,,
259,臺中市潭子區潭興路二段１４０巷１９號,,,
260,臺中市大里區中興路二段６７１巷８弄１６號,,,
261,臺中市大里區西榮路１５２巷３３號,,,
262,臺中市龍井區新興路２９號,,,
263,臺中市南區忠明南路１１４０號,,,
264,臺中市北區健行路４４３號,,,
265,臺中市西屯區東大路一段６８０號,,,
266,臺中市西屯區寶慶街３０巷９號,,,
267,臺中市南屯區龍富路三段５６２號,,,
268,臺中市外埔區甲后路五段１８６巷９號,,,
269,臺中市梧棲區自強一街９０巷３５號,,,
270,臺中市大里區長春路６號,,,
271,臺中市龍井區遠東街８１巷１之２０號,,,
272,臺中市北屯區文心路四段６７２號,,,
273,臺中市北屯區柳陽西街９３巷３９號,,,
274,臺中市西屯區福順路２１３號,,,
275,臺中市外埔區甲后路三段７８３巷７８號,,,
276,臺中市梧棲區自強一街９０巷３５號,,,
277,臺中市大雅區中山北路１１７巷２３號,,,
278,臺中市烏日區三榮六路６０巷７號,,,
279,臺中市太平區成功東路５６巷１５號,,,
280,臺中市豐原區鎌村路４６５巷１０４之３５號,,,
281,臺中市西區模範街１８巷２號,,,
282,臺中市北屯區北屯路２９８巷８之３號,,,
283,臺中市北區崇德路一段４９３號,,,
284,臺中市石岡區和盛街１３巷２７號,,,
285,臺中市東勢區文新二街３１號,,,
286,臺中市東勢區文新二街３１號,,,
287,臺中市北區大義街２９巷３７號,,,
288,臺中市西區向上路一段２８９巷９號,,,
289,臺中市西區美村路一段３２２巷１８號,,,
290,臺中市西區三民路１段５０巷８號,,,
291,臺中市中區臺灣大道一段３０６巷３５號,,,
292,臺中市中區臺灣大道一段３０６巷３５號,,,
293,臺中市北區柳川西路四段５３之５１號,,,
294,臺中市北區中山路３７１號,,,
295,臺中市北屯區北興街４５號,,,
296,臺中市北屯區松竹路二段１０７巷６６之３號,,,
297,臺中市北區健行路４４３號,,,
298,臺中市北屯區三光北二街５６號,,,
299,臺中市西屯區至善路１０１巷２８號,,,
300,臺中市西屯區筏堤東街一段３２之７號,,,
301,臺中市南屯區大墩十七街９１號,,,
302,臺中市大甲區中山路一段１０１２﹒１０１０之９號,,,
303,臺中市大雅區雅環路二段８６巷２２號,,,
304,臺中市大里區愛心路８４號,,,
305,臺中市西區向上南路一段３７號,,,
306,臺中市南區學府路１４６巷１５號,,,
307,臺中市潭子區復興路一段２０１巷５號,,,
308,臺中市南區仁義街８６－４號,,,
309,臺中市中區綠川西街１３５號,,,
310,臺中市北區三民路三段１６９號,,,
311,臺中市北區健行路４４３號,,,
312,臺中市北屯區四平路５６８巷７號,,,
313,臺中市北區北平路一段７７號,,,
314,臺中市南屯區大墩一街２４１之４號,,,
315,臺中市南屯區大墩一街２３５號,,,
316,臺中市龍井區遊園北路８８號,,,
317,臺中市龍井區龍泉街１６７號,,,
318,臺中市西區精誠路１３２巷２號,,,
319,臺中市西區五權西路一段２５７號,,,
320,臺中市中區綠川西街１３５號,,,
321,臺中市中區綠川西街１３５號,,,
322,臺中市北區漢口路四段１０２號,,,
323,臺中市北區天津路二段１３９號,,,
324,臺中市北屯區文心路四段２８８號,,,
325,臺中市南屯區文心南路２２７號,,,
326,臺中市南屯區大墩十一街３３１號,,,
327,臺中市大甲區中山路一段１２３７號,,,
328,臺中市沙鹿區國昌一街１７之２號,,,
329,臺中市東勢區名流街２５號,,,
330,臺中市大雅區雅潭路四段６６１巷９號,,,
331,臺中市大里區東南路１６６巷８號,,,
332,臺中市霧峰區中正路２２８巷３３號,,,
333,臺中市南區福德街１５０號,,,
334,臺中市南區工學路１２１號,,,
335,臺中市北屯區太原路三段１３５９號,,,
336,臺中市北屯區建和路二段３０５號,,,
337,臺中市南屯區公益路二段６１５之８號,,,
338,臺中市南屯區河南路四段５０６號,,,
339,臺中市西屯區順和六街１６號,,,
340,臺中市西屯區逢大路５２號,,,
341,臺中市西屯區文華路１３８巷８號,,,
342,臺中市豐原區瑞興路５０之２號,,,
343,臺中市大甲區光明路２６１巷２０號,,,
344,臺中市大甲區經國路３８３號,,,
345,臺中市清水區高美路３６５巷２２號,,,
346,臺中市龍井區龍北路３９１巷９６弄１７號,,,
347,臺中市東區旱溪東路一段２９２號,,,
348,臺中市北區大德街８２巷１６之３號,,,
349,臺中市北區中山路３７１號,,,
350,臺中市西屯區福安路１１號,,,
351,臺中市西屯區西安街２７７巷２５弄２號,,,
352,臺中市南屯區嶺東路９１６之９號,,,
353,臺中市西屯區成都路１５５號,,,
354,臺中市西屯區成都路１５５號,,,
355,臺中市西屯區福上巷龍欣一弄５號,,,
356,臺中市西屯區福上巷龍欣一弄１號,,,
357,臺中市南屯區三和街１０６之１號,,,
358,臺中市南屯區大昌街４４５號,,,
359,臺中市豐原區三村路３０巷１弄２０號,,,
360,臺中市神岡區和睦路一段５７５巷３４號,,,
361,臺中市大里區中元東路１０巷１４號,,,
362,臺中市太平區中興路５５之１９號,,,
363,臺中市太平區光興路１６９０巷６弄１２號,,,
364,臺中市龍井區遠東街３７之３號,,,
365,臺中市大肚區遊園路二段７４巷２弄３之２號,,,
366,臺中市西區五廊街８７號,,,
367,臺中市北區德化街４０１號,,,
368,臺中市西區美村路一段８０６號,,,
369,臺中市東區十甲路４３１號,,,
370,臺中市中區公園路２－５－９號,,,
371,臺中市北屯區旅順路一段１０４號,,,
372,臺中市北屯區僑孝街３２巷９５號,,,
373,臺中市北屯區天津路四段３０９號,,,
374,臺中市南屯區春安路１３０號,,,
375,臺中市大甲區水源路仁安巷１號,,,
376,臺中市外埔區土城東路６號,,,
377,臺中市梧棲區四維中路８號,,,
378,臺中市沙鹿區樂群新莊３之２號,,,
379,臺中市梧棲區自強一街９０巷３５號,,,
380,臺中市梧棲區臨港路四段５９６號,,,
381,臺中市沙鹿區文泉莊１號,,,
382,臺中市霧峰區柳豐二街１０號,,,
383,臺中市太平區環中東路三段９９號,,,
384,臺中市太平區宜昌路３３６號,,,
385,臺中市北區德化街２３之４號,,,
386,臺中市南屯區河南路四段５２２號,,,
387,臺中市太平區中興東路２６４號,,,
388,臺中市西區梅川西路一段１９號,,,
389,臺中市西區三民西路１７號,,,
390,臺中市北屯區昌平路一段２１巷２８號,,,
391,臺中市北區三民路三段１７９號,,,
392,臺中市北區東光東街７９號,,,
393,臺中市北屯區北平路三段１３３號,,,
394,臺中市北區北平二街１號,,,
395,臺中市北屯區東光路７５２號,,,
396,臺中市北屯區東山路一段１４６之２２號,,,
397,臺中市西屯區逢大路５０號,,,
398,臺中市西屯區大容東街１３８之２號,,,
399,臺中市西屯區市政路８９號,,,
400,臺中市西屯區國安一路５５號,,,
401,臺中市南屯區春安三街１９８號,,,
402,臺中市豐原區中山路５９巷２７號,,,
403,臺中市潭子區勝利路１７５號,,,
404,臺中市烏日區高鐵路二段１３６號,,,
405,臺中市大里區大智路５６５巷１７之６號,,,
406,臺中市太平區育德路１７號,,,
407,臺中市太平區永豐路１８巷２６號,,,
408,臺中市太平區環中東路三段５０７號,,,
409,臺中市南區復興路一段３１９之２０號,,,
410,臺中市南區美村路二段１１１號,,,
411,臺中市南區東興路一段２５號,,,
412,臺中市南區五權南路４８３號,,,
413,臺中市西區南屯路一段４１號,,,
414,臺中市南區工學一街１６９號,,,
415,臺中市北屯區綏遠路二段２０２號,,,
416,臺中市北屯區昌平一街６５號,,,
417,臺中市北屯區南興路１０８８號,,,
418,臺中市北區健行路４４３號,,,
419,臺中市南屯區保安五街２１１號,,,
420,臺中市南屯區永春東一路８０７巷２６號,,,
421,臺中市南屯區龍富路三段５３５號,,,
422,臺中市南屯區大墩南路１７９號,,,
423,臺中市西屯區至善路１０１巷２３號,,,
424,臺中市沙鹿區福鹿街２４９號,,,
425,臺中市大里區塗城路８６１號,,,
426,臺中市龍井區遠東街６０號,,,
427,臺中市南區西川一路１４９號,,,
428,臺中市西區臺灣大道二段９９巷５號,,,
429,臺中市西區大墩十街６１號,,,
430,臺中市北屯區綏遠路二段４１號,,,
431,臺中市北區英才路３６４號,,,
432,臺中市北區五常街３８０號,,,
433,臺中市西屯區東興路三段３０９號,,,
434,臺中市西屯區四川路８７巷８２號,,,
435,臺中市沙鹿區臺灣大道七段４３２巷６６弄７６號,,,
436,臺中市大肚區沙田路一段４２８巷２２之５號,,,
437,臺中市大肚區遊園路二段７９巷３５弄１３號,,,
438,臺中市西區民生路１５０號,,,
439,臺中市東區東英十三街９９號,,,
440,臺中市東區復興路五段１８６號,,,
441,臺中市西區美村路一段５２巷３２號,,,
442,臺中市東區公園東路５５號,,,
443,臺中市中區中華路１段１２１號,,,
444,臺中市南區和昌街３１８號,,,
445,臺中市南區復興路３段１１６巷５弄２之２號,,,
446,臺中市北屯區環太東路６２２號,,,
447,臺中市北區英才路３６４號,,,
448,臺中市北區英才路３６４號,,,
449,臺中市北屯區崇德八路一段１６６號,,,
450,臺中市北屯區文心路四段２８８號,,,
451,臺中市北區東光七街２８號,,,
452,臺中市北區育德路１１８號,,,
453,臺中市北區雙十路二段４２號,,,
454,臺中市西屯區西屯路二段２６８之８巷１號,,,
455,臺中市神岡區大豐北街１１巷３號,,,
456,臺中市后里區泉州路３３巷１１號,,,
457,臺中市后里區甲后路一段２６１巷１１６弄１８號,,,
458,臺中市梧棲區自強一街９０巷３５號,,,
459,臺中市清水區海濱路２２１之５３號,,,
460,臺中市大里區塗城路９２３巷３號,,,
461,臺中市大里區仁化工二路７６號,,,
462,臺中市烏日區高鐵路二段１３６號,,,
463,臺中市大里區公園街２１８號,,,
464,臺中市霧峰區錦州路３１６號,,,
465,臺中市太平區育才路３６７號,,,
466,臺中市太平區坪林路１９號,,,
467,臺中市大肚區遊園路一段１５０巷１２６之２號,,,
468,臺中市北屯區綏遠路二段７２號,,,
469,臺中市北區五權路２４７號,,,
470,臺中市西區篤行路１８５號,,,
471,臺中市西區中華路一段１－７號,,,
472,臺中市西區臺灣大道二段１３９號,,,
473,臺中市西區大忠南街９２巷８號,,,
474,臺中市南區學府路７５號,,,
475,臺中市西區向上路一段２９巷１１號,,,
476,臺中市北區篤行路４０８之１號,,,
477,臺中市北屯區綏遠路二段３８號,,,
478,臺中市北屯區軍福十八路１０１號,,,
479,臺中市北區五權路２４７號,,,
480,臺中市西屯區西屯路二段２６８之８巷１號,,,
481,臺中市西屯區西屯路二段２６８之８巷１號,,,
482,臺中市西屯區西屯路二段２６８之８巷１號,,,
483,臺中市南屯區永春路８０巷１０號,,,
484,臺中市西屯區至善路２４０號,,,
485,臺中市南屯區寶山東一街９號,,,
486,臺中市南屯區大墩三街１６號,,,
487,臺中市豐原區博愛街６０巷３８號,,,
488,臺中市后里區中興街１５８巷１弄１８號,,,
489,臺中市神岡區光復路３７５巷６０之３號,,,
490,臺中市豐原區安康路４５號,,,
491,臺中市豐原區南陽路１５４之１號,,,
492,臺中市豐原區豐陽路７０號,,,
493,臺中市清水區神清路９之７號,,,
494,臺中市梧棲區臨港路四段５９６號,,,
495,臺中市清水區五權路１８５號,,,
496,臺中市大里區公園街２１０號,,,
497,臺中市大里區益民路一段６２巷３６弄８之２號,,,
498,臺中市大里區公園街４２１巷５２號,,,
499,臺中市烏日區高鐵一路２６８號,,,
500,臺中市太平區旱溪東路二段３２１號,,,
501,臺中市龍井區龍社路４５２號,,,
502,臺中市大肚區遊園路二段１９０之６號,,,
503,臺中市南區南平路３３８巷８號,,,
