id,Address,Response_Address,Response_X,Response_Y
2492,臺中市大雅區神林南路１７３巷２弄８號,,,
2493,臺中市霧峰區育群路６４號,,,
2494,臺中市大里區德芳南路３０６巷５號,,,
2495,臺中市烏日區溪南路一段１２６巷３１８號,,,
2496,臺中市太平區中山路一段２４３巷２６號,,,
2497,臺中市南區南和路１７３號,,,
2498,臺中市西區東興路三段２９號,,,
2499,臺中市南區復興路３段１１１巷１號,,,
2500,臺中市北屯區文心路四段６５號,,,
2501,臺中市北區衛道路８９之５號,,,
2502,臺中市北屯區文昌東十二街３８號,,,
2503,臺中市北區漢口路四段６２號,,,
2504,臺中市北區進化路５１９號,,,
2505,臺中市北屯區松竹路二段３６０號,,,
2506,臺中市西屯區國安一路６７之１號,,,
2507,臺中市南屯區五權西路二段６２９號,,,
2508,臺中市南屯區大進街５１０號,,,
2509,臺中市西屯區青海路二段４０６號,,,
2510,臺中市后里區四村路１５７號,,,
2511,臺中市神岡區社口街５４２巷３號,,,
2512,臺中市清水區學園街２６巷１號,,,
2513,臺中市清水區民族路三段５３號,,,
2514,臺中市沙鹿區臺灣大道七段８２６號,,,
2515,臺中市梧棲區大勇二路１２號,,,
2516,臺中市沙鹿區永寧路一段５號,,,
2517,臺中市新社區興社街一段國校巷４６號,,,
2518,臺中市潭子區雅豐街７６巷４３號,,,
2519,臺中市潭子區僑興路１６９號,,,
2520,臺中市大里區喬城路１１４號,,,
2521,臺中市南區新和街１１號,,,
2522,臺中市北區育樂街８８號,,,
2523,臺中市北區進化北路３１７號,,,
2524,臺中市北區太原路一段２４０號,,,
2525,臺中市北屯區敦富路７０８號,,,
2526,臺中市北屯區軍榮一街３５號,,,
2527,臺中市北屯區文心路四段９３４號,,,
2528,臺中市西屯區文心路二段５４６號,,,
2529,臺中市南屯區南屯路二段４８６號,,,
2530,臺中市西屯區西屯路二段２６８之８巷１號,,,
2531,臺中市南屯區文心路一段３８３號,,,
2532,臺中市南屯區春安三街１９３號,,,
2533,臺中市南屯區黎明路一段３０６號,,,
2534,臺中市沙鹿區中山路６５１巷３７號,,,
2535,臺中市梧棲區四維路７１巷２號,,,
2536,臺中市梧棲區臨港路四段５９２號,,,
2537,臺中市大里區國寶街４８巷２２號,,,
2538,臺中市烏日區新興路３５０巷８號,,,
2539,臺中市霧峰區新埔路２２８巷１弄１１號,,,
2540,臺中市大肚區中蔗路２巷１弄２１號,,,
2541,臺中市南區忠明南路１２４０巷１２弄１２號,,,
2542,臺中市西區向上路一段７７號,,,
2543,臺中市北屯區大連路三段２１巷５５號,,,
2544,臺中市西屯區臺灣大道四段１１４０號,,,
2545,臺中市南屯區春安路７６號,,,
2546,臺中市西屯區西安街１３１號,,,
2547,臺中市豐原區三豐路二段２２９巷９８弄２６號,,,
2548,臺中市清水區菁埔路７７之１８號,,,
2549,臺中市梧棲區港埠路二段１３８號,,,
2550,臺中市潭子區復興路一段７０號,,,
2551,臺中市烏日區環河路四段２７８號,,,
2552,臺中市烏日區榮泉路１８９號,,,
2553,臺中市龍井區竹師路二段１０５巷８號,,,
2554,臺中市西區忠明南路２２號,,,
2555,臺中市西區五權路１－７號,,,
2556,臺中市北區衛道七街３號,,,
2557,臺中市北區衛道七街２號,,,
2558,臺中市北屯區崇德二路一段１５７巷１３號,,,
2559,臺中市北屯區松文街２７號,,,
2560,臺中市北區進化路３３２號,,,
2561,臺中市北區陝西東一街３４之３號,,,
2562,臺中市南屯區南屯路二段８１２號,,,
2563,臺中市西屯區成都路１４之１號,,,
2564,臺中市南屯區龍富十路１０２號,,,
2565,臺中市西屯區河南路四段７０號,,,
2566,臺中市南屯區大光街１８４巷１９號,,,
2567,臺中市豐原區水源路７巷２００號,,,
2568,臺中市豐原區南陽路３０１巷１８弄３０號,,,
2569,臺中市大甲區八德街８３號,,,
2570,臺中市沙鹿區臺灣大道六段７５１號,,,
2571,臺中市梧棲區港新一路６７號,,,
2572,臺中市梧棲區臨港路四段５８８號,,,
2573,臺中市梧棲區臨港路四段５９２號,,,
2574,臺中市大里區益民路二段４０１號,,,
2575,臺中市大里區上興街二段５１巷７號,,,
2576,臺中市太平區宜欣一街４３巷６弄２０號,,,
2577,臺中市西區向上南路一段１５８號,,,
2578,臺中市北屯區興安路二段３８號,,,
2579,臺中市北屯區崇德二路一段２４２號,,,
2580,臺中市西屯區臺灣大道三段５９２號,,,
2581,臺中市南屯區文心路一段３７８號,,,
2582,臺中市南屯區文心路一段３７８號,,,
2583,臺中市南屯區文心路一段３７８號,,,
2584,臺中市西屯區長安路二段１７１號,,,
2585,臺中市西屯區永昌三街１４之３號,,,
2586,臺中市豐原區向陽路４８號,,,
2587,臺中市梧棲區大勇二路１８號,,,
2588,臺中市梧棲區博愛路１５５巷３７弄１０號,,,
2589,臺中市霧峰區草湖路１３５巷２號,,,
2590,臺中市大里區永東街７號,,,
2591,臺中市太平區永成北路２１２號,,,
2592,臺中市太平區中山路三段６７巷５６號,,,
2593,臺中市龍井區龍新路２１６巷８０號,,,
2594,臺中市北屯區遼陽一街２４之３號,,,
2595,臺中市西區臺灣大道二段５２５號,,,
2596,臺中市東區進德路３５７號,,,
2597,臺中市西區五權八街１４３號,,,
2598,臺中市中區民權路１６４號,,,
2599,臺中市北屯區建和路二段３０５號,,,
2600,臺中市北屯區松竹五路一段４０６號,,,
2601,臺中市北區忠太東路１１９號,,,
2602,臺中市北屯區軍福十六路３５２號,,,
2603,臺中市北區漢口路四段３７３號,,,
2604,臺中市北區天祥街８４巷４之２號,,,
2605,臺中市北區崇德路一段９１巷１之３號,,,
2606,臺中市西屯區大弘街９７號,,,
2607,臺中市南屯區向上路一段６９０號,,,
2608,臺中市西屯區文心路二段５６６之１２號,,,
2609,臺中市南屯區文心一路３５１號,,,
2610,臺中市西屯區福瑞街７５巷１１號,,,
2611,臺中市潭子區福潭路２１５號,,,
2612,臺中市烏日區環河路四段２７８號,,,
2613,臺中市大里區東榮路４４６之１２號,,,
2614,臺中市北屯區崇德六路２８號,,,
2615,臺中市北區西屯路二段７號,,,
2616,臺中市中區光復路１０４號,,,
2617,臺中市西區府後街４７巷４號,,,
2618,臺中市東區東英路７６６號,,,
2619,臺中市北屯區北屯路２１０號,,,
2620,臺中市南屯區大墩七街５２６號,,,
2621,臺中市南屯區楓樹巷１０號,,,
2622,臺中市西屯區市政路３８６號,,,
2623,臺中市神岡區豐洲路２５５號,,,
2624,臺中市豐原區豐勢路１１３巷５３號,,,
2625,臺中市沙鹿區臺灣大道六段７５９號,,,
2626,臺中市沙鹿區保定路１９５號,,,
2627,臺中市大里區中湖路１５０巷３０號,,,
2628,臺中市霧峰區民生路８９巷１０號,,,
2629,臺中市烏日區中山路一段２之１５號,,,
2630,臺中市大里區塗城路９７巷４８號,,,
2631,臺中市南區福田一街１５８號,,,
2632,臺中市北屯區敦化路一段５９９號,,,
2633,臺中市北區西屯路一段３３７巷４之４號,,,
2634,臺中市北屯區四平路２３８巷２５號,,,
2635,臺中市北屯區松竹路二段１７８巷３３號,,,
2636,臺中市北屯區松竹路二段１６０巷８之４號,,,
2637,臺中市南屯區忠勇路５２之２３９號,,,
2638,臺中市西屯區西屯路二段２６０之１９號,,,
2639,臺中市外埔區六分路１０８之１號,,,
2640,臺中市沙鹿區福成路４８巷８號,,,
2641,臺中市清水區忠孝路１７８巷６號,,,
2642,臺中市潭子區大德北路１２３巷６號,,,
2643,臺中市烏日區興祥街２０巷２７號,,,
2644,臺中市大里區中興路一段１３７巷３之５號,,,
2645,臺中市太平區環中東路三段９７號,,,
2646,臺中市太平區新興二街１３６號,,,
2647,臺中市太平區祥順路一段９９號,,,
2648,臺中市太平區合利街１５巷５號,,,
2649,臺中市龍井區新庄街一段９６巷９６弄９１號,,,
2650,臺中市大肚區遊園路二段１９８巷１１之３號,,,
2651,臺中市東區樂業路１０５巷１１號,,,
2652,臺中市東區樂業路１０５巷１３號,,,
2653,臺中市北屯區環太東路６２７號,,,
2654,臺中市西屯區西屯路二段２４７號,,,
2655,臺中市東區樂業一路７號,,,
2656,臺中市中區光復路２２號,,,
2657,臺中市北區青島路一段４０２號,,,
2658,臺中市北屯區大連路二段２０７之９號,,,
2659,臺中市北屯區崇仁街５８巷１２號,,,
2660,臺中市北區綏遠路一段２６號,,,
2661,臺中市北屯區瀋陽路三段１０９號,,,
2662,臺中市神岡區八德路３５３巷３１弄２８號,,,
2663,臺中市大甲區水源路４５２巷５２號,,,
2664,臺中市梧棲區中央路一段１５５之１９號,,,
2665,臺中市梧棲區四維東路１１６號,,,
2666,臺中市梧棲區仁美街２５５巷６３號,,,
2667,臺中市梧棲區自強一街１１４巷１１號,,,
2668,臺中市大雅區學府路４５７號,,,
2669,臺中市大里區東南路１６４之１號,,,
2670,臺中市大里區益民路二段２９１之８號,,,
2671,臺中市大里區立仁三路１７巷１１號,,,
2672,臺中市大里區環中東路六段１６巷２號,,,
2673,臺中市大里區至善路１１２號,,,
2674,臺中市南區福田五街２２號,,,
2675,臺中市南區有恆街１５號,,,
2676,臺中市南區大慶街二段６－１６巷４５號,,,
2677,臺中市南區福中街７號,,,
2678,臺中市北屯區松義街１７２號,,,
2679,臺中市北屯區松竹五路一段３９６號,,,
2680,臺中市北屯區崇德路一段６２９號,,,
2681,臺中市西屯區安林路２５之１５號,,,
2682,臺中市西屯區逢甲路２２５巷４８號,,,
2683,臺中市南屯區東興路二段３１號,,,
2684,臺中市南屯區五權西路二段８０３號,,,
2685,臺中市西屯區惠來路三段１９８之２號,,,
2686,臺中市西屯區中康街７號,,,
2687,臺中市南屯區豐偉路１８６號,,,
2688,臺中市外埔區水美路９５號,,,
2689,臺中市沙鹿區北中七街７７號,,,
2690,臺中市清水區港新五路１５８號,,,
2691,臺中市大雅區民族街６６巷７號,,,
2692,臺中市烏日區環河路五段２５０號,,,
2693,臺中市烏日區高鐵路二段１５０號,,,
2694,臺中市烏日區健行南路１７號,,,
2695,臺中市太平區新興二街１３０號,,,
2696,臺中市太平區新和街３６號,,,
2697,臺中市南區東興路一段２５巷１１號,,,
2698,臺中市南區復新街５５號,,,
2699,臺中市中區三民路２段８８號,,,
2700,臺中市北區進化北路３１７號,,,
2701,臺中市北屯區山西路三段４１６號,,,
2702,臺中市北區東光東街４９號,,,
2703,臺中市西屯區漢成一街１７號,,,
2704,臺中市西屯區西屯路二段湳子巷９之１３號,,,
2705,臺中市南屯區大墩四街３２６之１７號,,,
2706,臺中市南屯區楓樹西街１８９號,,,
2707,臺中市大甲區黎明路２之１７６號,,,
2708,臺中市大里區亞洲街１６１之３號,,,
2709,臺中市烏日區中華路６１２巷２９號,,,
2710,臺中市西區健行路１０４９號,,,
2711,臺中市西區模範街１２巷６號,,,
2712,臺中市北屯區敦富一街１６２號,,,
2713,臺中市潭子區雅豐街７６巷２９弄２３號,,,
2714,臺中市大里區新明路５９號,,,
2715,臺中市北區天津路二段４９巷８號,,,
2716,臺中市東區進德路３５９號,,,
2717,臺中市東區富台東街４６號,,,
2718,臺中市南區忠明南路７３０巷２３號,,,
2719,臺中市西區精誠三十街４３號,,,
2720,臺中市北區文心路四段１９０號,,,
2721,臺中市北屯區松竹五路二段１６５號,,,
2722,臺中市北屯區敦化路一段５９９號,,,
2723,臺中市北區國豐街５２巷２８號,,,
2724,臺中市西屯區逢甲路３０１巷２２弄１２號,,,
2725,臺中市南屯區河南路四段６９０巷５之１０號,,,
2726,臺中市西屯區惠中路一段１９８號,,,
2727,臺中市南屯區春安路１２８號,,,
2728,臺中市西屯區成都路２１６號,,,
2729,臺中市后里區三光路１７號,,,
2730,臺中市大甲區順帆一街１９５巷１８號,,,
2731,臺中市潭子區弘智一街１６８號,,,
2732,臺中市潭子區中山路一段７９號,,,
2733,臺中市大雅區學府路４６７巷９號,,,
2734,臺中市大里區新生路１７１巷１８弄２號,,,
2735,臺中市西區臺灣大道一段７０３號,,,
2736,臺中市南區工學一街１６７巷１２號,,,
2737,臺中市南區工學北路１１５號,,,
2738,臺中市北屯區文心路四段５２８號,,,
2739,臺中市北屯區松竹路二段３６２之１８號,,,
2740,臺中市北區國泰街８４巷２０弄５之４號,,,
2741,臺中市西屯區長安路二段７１巷９弄１８號,,,
2742,臺中市神岡區中平路２６７巷１７號,,,
2743,臺中市大甲區雁門路２９０巷６０弄１９號,,,
2744,臺中市大雅區學府路１２０巷１７號,,,
2745,臺中市霧峰區吉峰路２６巷７號,,,
2746,臺中市太平區大源十三街２６之５號,,,
2747,臺中市太平區新平路三段３０８號,,,
2748,臺中市西屯區大安街１８號,,,
2749,臺中市東區一心街２４３號,,,
2750,臺中市北區育德路１０號,,,
2751,臺中市西屯區青海路二段１８８號,,,
2752,臺中市南屯區楓平路５３７號,,,
2753,臺中市西屯區天水西街８號,,,
2754,臺中市西屯區市政路１９號,,,
2755,臺中市南屯區大墩四街１０號,,,
2756,臺中市南屯區大墩六街２３９號,,,
2757,臺中市豐原區仁洲街３６號,,,
2758,臺中市梧棲區港埠路二段１３８號,,,
2759,臺中市大里區合信街１９號,,,
2760,臺中市大里區德芳路二段１３９號,,,
2761,臺中市烏日區中華路１８５巷３號,,,
2762,臺中市太平區新興路１７２號,,,
2763,臺中市南區樹義路２６８號,,,
2764,臺中市東區一心街４００號,,,
2765,臺中市西區自由路一段１９－１０號,,,
2766,臺中市西區民權路２２９巷２１號,,,
2767,臺中市北屯區詔安街６６號,,,
2768,臺中市潭子區嘉豐路３３８巷１４０之２號,,,
2769,臺中市龍井區龍社路５８５號,,,
2770,臺中市西區三民路１段５０巷８號,,,
2771,臺中市南區學府路１３５巷３０號,,,
2772,臺中市西區華美西街一段１３７號,,,
2773,臺中市北屯區四平路４０５之３號,,,
2774,臺中市南屯區嶺東南路１５１號,,,
2775,臺中市西屯區環中路三段６９號,,,
2776,臺中市西屯區太原路一段２１７之２號,,,
2777,臺中市西屯區大容西街６３號,,,
2778,臺中市清水區鰲峰路３８巷５弄２２號,,,
2779,臺中市大雅區平和南路６１號,,,
2780,臺中市太平區建興路２７５巷３３號,,,
2781,臺中市大肚區大明四街２１６號,,,
2782,臺中市東區振興路３５８巷４７號,,,
2783,臺中市太平區旱溪西路二段２１２巷８８號,,,
2784,臺中市南區柳川東路１段１００號,,,
2785,臺中市中區三民路二段１２３號,,,
2786,臺中市南區美村南路５３號,,,
2787,臺中市北屯區敦富路７１１號,,,
2788,臺中市北屯區文心路四段６７２號,,,
2789,臺中市北區青島東街１號,,,
2790,臺中市北屯區文心路四段２８８號,,,
2791,臺中市南屯區文心南三路５２８號,,,
2792,臺中市西屯區大墩十九街３號,,,
2793,臺中市大甲區幼五路１號,,,
2794,臺中市梧棲區居仁街６３巷１８號,,,
2795,臺中市太平區中山路二段３２巷５６號,,,
2796,臺中市太平區育德路１５號,,,
2797,臺中市龍井區沙田路六段２２３號,,,
2798,臺中市中區自由路二段８７號,,,
2799,臺中市北區育樂街５８號,,,
2800,臺中市南屯區益昌五街７０號,,,
2801,臺中市清水區中興街１４０號,,,
2802,臺中市沙鹿區平等路１５２巷１６８弄８號,,,
2803,臺中市大里區新仁路三段３１巷１弄１０號,,,
2804,臺中市烏日區三榮路一段４０７號,,,
2805,臺中市南區忠明南路１１０８號,,,
2806,臺中市北區陝西八街２號,,,
2807,臺中市北屯區東光路８６６號,,,
2808,臺中市北區進化路５１３號,,,
2809,臺中市北屯區崇德六路一段３０巷１６號,,,
2810,臺中市南屯區東興路二段１８６號,,,
2811,臺中市豐原區豐原大道七段１６２巷３０６弄１９號,,,
2812,臺中市清水區港新三路３５號,,,
2813,臺中市石岡區豐勢路１０１８號,,,
2814,臺中市潭子區僑興一街２２０號,,,
2815,臺中市烏日區麻園東二街９號,,,
2816,臺中市烏日區三榮三路５號,,,
2817,臺中市東區復興路五段１３７號,,,
2818,臺中市南區工學二街１１７號,,,
2819,臺中市西區臺灣大道二段２８５號,,,
2820,臺中市北區梅川東路三段６２巷１３號,,,
2821,臺中市西屯區華夏巷西五弄２０號,,,
2822,臺中市豐原區南陽路１２３巷５９弄４５號,,,
2823,臺中市大甲區新美街３７號,,,
2824,臺中市沙鹿區明秀二街１１８巷３０號,,,
2825,臺中市大雅區昌平路四段２８２北三巷２８號,,,
2826,臺中市龍井區龍港路３４９巷５８弄４８號,,,
2827,臺中市西區五權八街１４５號,,,
2828,臺中市南區有恆街８巷５號,,,
2829,臺中市北區育樂街６２號,,,
2830,臺中市北區雙十路二段１００巷８弄９號,,,
2831,臺中市北屯區崇德路二段１６８號,,,
2832,臺中市西屯區逢甲路１９巷１０號,,,
2833,臺中市西屯區中清西二街９２巷１６弄１３號,,,
2834,臺中市西屯區東興路三段３１５號,,,
2835,臺中市沙鹿區平等十一街５５巷９號,,,
2836,臺中市梧棲區臨港路四段５８８號,,,
2837,臺中市潭子區潭興路二段２１８號,,,
2838,臺中市大雅區神林南路１７３巷１弄２８號,,,
2839,臺中市太平區廣三街１８號,,,
2840,臺中市太平區永平路二段４７６巷１４０號,,,
2841,臺中市西區五權西四街２７號,,,
2842,臺中市南區建國南路一段２４５號,,,
2843,臺中市北屯區南興北二路８號,,,
2844,臺中市北區進化北路２５９號,,,
2845,臺中市北區德化街１１５號,,,
2846,臺中市西屯區大容東街８８號,,,
2847,臺中市西屯區市政北二路２８２號,,,
2848,臺中市西屯區漢翔路２２５號,,,
2849,臺中市潭子區中山路二段５６號,,,
2850,臺中市龍井區三港路水裡港巷４１弄７號,,,
2851,臺中市北區興進路９７號,,,
2852,臺中市北區梅亭街５號,,,
2853,臺中市北屯區豐樂路１８之２５號,,,
2854,臺中市北區大德街４９號,,,
2855,臺中市西屯區長安路二段１１８之５號,,,
2856,臺中市太平區華安街１３６巷３號,,,
2857,臺中市北區華富街７５號,,,
2858,臺中市西屯區文心路三段１２９巷８號,,,
2859,臺中市南屯區文心南路２２７號,,,
2860,臺中市神岡區昌平路五段１０９巷６３弄２３號,,,
2861,臺中市大里區西村路１５巷７號,,,
2862,臺中市南區美村南路５１巷１８號,,,
2863,臺中市北屯區文昌二街１５０號,,,
2864,臺中市北屯區天津路四段２１１號,,,
2865,臺中市北屯區南興路９２５號,,,
2866,臺中市北屯區北平路四段１５７號,,,
2867,臺中市北屯區崇德六路一段３１巷７號,,,
2868,臺中市西屯區寧夏東三街１７之１號,,,
2869,臺中市清水區三美路１１９之１號,,,
2870,臺中市大里區塗城路７１３巷１５之６號,,,
2871,臺中市西區三民路一段５８－３號,,,
2872,臺中市西區三民路一段５８－３號,,,
2873,臺中市北屯區后庄一街１３２號,,,
2874,臺中市烏日區環河路五段１１６號,,,
2875,臺中市大里區塗城路７１３巷３號,,,
2876,臺中市大里區立仁路２１５號,,,
2877,臺中市太平區長億九街１１３號,,,
2878,臺中市太平區祥順路一段３８６巷１８號,,,
2879,臺中市大肚區營埔一街１０１號,,,
2880,臺中市北區美德街２５７號,,,
2881,臺中市北屯區軍福九路１６０號,,,
2882,臺中市北屯區昌平路二段５０之６巷２１號,,,
2883,臺中市南屯區向上南路一段１６３號,,,
2884,臺中市沙鹿區光華路３９１巷５５號,,,
2885,臺中市太平區環中東路三段３８７號,,,
2886,臺中市西區向上南路１段１１６號,,,
2887,臺中市西區福人街１２１巷３８號,,,
2888,臺中市北屯區崇德路二段１８號,,,
2889,臺中市北區育樂街９０號,,,
2890,臺中市北區武漢街１００號,,,
2891,臺中市豐原區豐南街５１巷１７號,,,
2892,臺中市潭子區僑興一街２１８號,,,
2893,臺中市大肚區文昌路三段１巷７５弄１４號,,,
2894,臺中市龍井區龍新路２１６巷８２號,,,
2895,臺中市西區三民路一段５０巷８號,,,
2896,臺中市北屯區北平路四段１８９之３號,,,
2897,臺中市神岡區社口街６０巷１２號,,,
2898,臺中市潭子區弘智街５１號,,,
2899,臺中市烏日區三榮三路７號,,,
2900,臺中市北屯區太順一街５９號,,,
2901,臺中市南屯區益文一街１３１號,,,
2902,臺中市南屯區南屯路二段８６０巷２８弄１２之２號,,,
2903,臺中市大里區中興路一段３５６號,,,
2904,臺中市大里區新仁路一段２１７巷３０號,,,
2905,臺中市西區自治街５７號,,,
2906,臺中市西區美村路一段２７２號,,,
2907,臺中市北屯區瀋陽路一段６５號,,,
2908,臺中市潭子區圓通南路９３巷２７號,,,
2909,臺中市南屯區益昌六街８號,,,
2910,臺中市太平區振福路６１０號,,,
2911,臺中市太平區永安街３７號,,,
2912,臺中市豐原區仁洲街３２號,,,
2913,臺中市南區工學路１５５巷６號,,,
2914,臺中市南區五權南一路５５號,,,
2915,臺中市北區中清路一段５３號,,,
2916,臺中市北屯區北屯路４０９之１２號,,,
2917,臺中市潭子區潭富路一段１４４巷３５號,,,
2918,臺中市龍井區遊園南路１４３巷９號,,,
2919,臺中市東區東光園路１００巷６弄１９５號,,,
2920,臺中市東區公園東路６７號,,,
2921,臺中市東區公園東路６７號,,,
2922,臺中市南區興大路４６號,,,
2923,臺中市北屯區軍福十六路２９９號,,,
2924,臺中市南屯區大墩三街６５號,,,
2925,臺中市南屯區寶山五街１１７之２７號,,,
2926,臺中市潭子區豐栗路９１巷５號,,,
2927,臺中市西區大全街１２０號,,,
2928,臺中市北屯區北屯路４３９號,,,
2929,臺中市北屯區崇德二路一段１４８號,,,
2930,臺中市北屯區松和街１９５號,,,
2931,臺中市潭子區榮興街８３巷２９號,,,
2932,臺中市烏日區三榮二路２９號,,,
2933,臺中市西區華美街１３１號,,,
2934,臺中市東區公園東路５７號,,,
2935,臺中市中區成功路３５９－２號,,,
2936,臺中市南區學府路１３５巷５號,,,
2937,臺中市中區光復路１５１號,,,
2938,臺中市北屯區遼陽一街３５號,,,
2939,臺中市北屯區瀋陽北路１３巷６５號,,,
2940,臺中市北區柳川西路四段１號,,,
2941,臺中市北區進化路５１３號,,,
2942,臺中市北屯區興安路二段４６１巷５８弄１１號,,,
2943,臺中市北區柳川西路四段１號,,,
2944,臺中市北區柳川西路四段１號,,,
2945,臺中市西屯區弘孝路２５７號,,,
2946,臺中市西屯區西安街１３１號,,,
2947,臺中市西屯區工業區一路６８號,,,
2948,臺中市西屯區文華路７０號,,,
2949,臺中市南屯區惠文路３６１號,,,
2950,臺中市南屯區惠文路３６１號,,,
2951,臺中市神岡區大漢街５２號,,,
2952,臺中市豐原區保康路５０號,,,
2953,臺中市清水區港都路７號,,,
2954,臺中市清水區港新五路２１５號,,,
2955,臺中市烏日區公園路７３６巷５６弄３號,,,
2956,臺中市烏日區中華路３７６巷２０號,,,
2957,臺中市太平區東平路４３０號,,,
2958,臺中市太平區中山路一段３２２巷１１７弄２之３號,,,
2959,臺中市龍井區新仁路２２巷１８號,,,
2960,臺中市南區忠明南路１２４０巷５號,,,
2961,臺中市南區高工路２７６號,,,
2962,臺中市北屯區文心路四段６７２號,,,
2963,臺中市北區文昌東一街２８號,,,
2964,臺中市北屯區崇德五路４８巷８號,,,
2965,臺中市北屯區山西路三段４２９號,,,
2966,臺中市北屯區三光一街１６０號,,,
2967,臺中市北屯區敦富路８８６號,,,
2968,臺中市北屯區安順東四街２號,,,
2969,臺中市北區民權路４１５號,,,
2970,臺中市北區雙十路二段１巷３之４號,,,
2971,臺中市豐原區南陽路綠山巷７弄５１之１號,,,
2972,臺中市大甲區幼獅路７６號,,,
2973,臺中市梧棲區臨港路四段５９０號,,,
2974,臺中市梧棲區博愛路６０號,,,
2975,臺中市梧棲區臨港路四段５９２號,,,
2976,臺中市梧棲區港新一路６５號,,,
2977,臺中市潭子區民族路三段１２３巷１之２３號,,,
2978,臺中市大里區工業路宏巨２巷６弄４７號,,,
2979,臺中市太平區旱溪東路二段１１２號,,,
2980,臺中市太平區坪林路４２巷１１號,,,
2981,臺中市西區精誠路１２６號,,,
2982,臺中市南屯區大英街３５號,,,
